{
  "id": "12345",
  "locationId": "12345",
  "supplementalMATSParameterCode": "string",
  "supplementalMATSMonitoringMethodCode": "string",
  "beginDate": "2024-01-15T12:00:00Z",
  "beginHour": 0.0,
  "endDate": "2024-01-15T12:00:00Z",
  "endHour": 0.0,
  "userId": "12345",
  "addDate": "2024-01-15T12:00:00Z",
  "updateDate": "2024-01-15T12:00:00Z",
  "location": "example"
}